<?xml version="1.0" encoding="UTF-8"?>
<ns1:facturas  xmlns:xsi="http://www.w3.org/2001/XMLSchema-instance"
               xsi:schemaLocation="facturas XMLSchemaAvanzados05_videoclub.xsd"
			   xmlns:ns1="facturas">
       <ns1:factura>
            <ns1:datos_cliente ident="abcd">
                <ns1:nombre>Juan</ns1:nombre>
                <ns1:apellido>López</ns1:apellido>
                <ns1:apellido>Jiménez</ns1:apellido>
                <ns1:dni>11111111N</ns1:dni>
                <ns1:tfno>123456789</ns1:tfno>
            </ns1:datos_cliente>
            <ns1:datos_factura>
                <ns1:resguardo>
                    <ns1:forma_pago>
                        Efectivo
                    </ns1:forma_pago>
                    <ns1:importe_total>
                        1256325.23
                    </ns1:importe_total>
                </ns1:resguardo>
                <ns1:alquileres>
                    <ns1:fecha>2010-12-25</ns1:fecha>
                    <ns1:peliculas>
                        <ns1:pelicula id_pelicula="ABC" valoracion="buena">
                            <ns1:titulo>El retorno del Jedi</ns1:titulo>
                            <ns1:genero>Espacio</ns1:genero>
                            <ns1:duracion>125</ns1:duracion>
                            <ns1:actores>
                                <ns1:actor>
                                    <ns1:nombre>Juan</ns1:nombre>
                                    <ns1:apellido>Pardo</ns1:apellido>
                                    <ns1:apellido>López</ns1:apellido>
                                </ns1:actor>
                                <ns1:actor>
                                    <ns1:nombre>Manuel</ns1:nombre>
                                    <ns1:apellido>Bandera</ns1:apellido>
                                    <ns1:apellido>Garrido</ns1:apellido>
                                </ns1:actor>
                                <ns1:actor>
                                    <ns1:nombre>Luis</ns1:nombre>
                                    <ns1:apellido>González</ns1:apellido>
                                    <ns1:apellido>Romero</ns1:apellido>
                                </ns1:actor>
                            </ns1:actores>
                        </ns1:pelicula>
                    </ns1:peliculas>
                </ns1:alquileres>
            </ns1:datos_factura>
       </ns1:factura>
</ns1:facturas>
